Category,BadBrand,BadProduct,Rating,Reason,BadBrandLogo,Swap1,Swap1Price,Swap1Link,Swap1Image,Swap1Rating,Swap1Code,Swap2,Swap2Price,Swap2Link,Swap2Image,Swap2Rating,Swap2Code,Swap3,Swap3Price,Swap3Link,Swap3Image,Swap3Rating,Swap3Code,VideoLink
Toothpaste,Ollie,10% nHap Remineralizing Toothpaste Orange,2,"Nano-hydroxyapatite, calcium carbonate, double silica, and a hidden flavor, never lab tested for metals.",,Weleda Natural Salt Toothpaste,$9-$11,https://amzn.to/4ufwk48,https://clarityinsightadvisory.com/wp-content/uploads/2026/03/weleda-toothpaste.webp,9,,Essential Oxygen BR Toothpaste,$10-$20,https://amzn.to/4aU1qHa,https://clarityinsightadvisory.com/wp-content/uploads/2026/03/essential-oxygen-toothpaste.webp,9,,,,,,,,https://www.instagram.com/thewallstsurvivor/reel/DX7ugz1RmMw/
Toothpaste,Lumineux,Teeth Whitening Toothpaste,4,"No calcium carbonate or hydroxyapatite, just silica, an unexplained pigment, and sea salt, with no lab test.",,Weleda Natural Salt Toothpaste,$9-$11,https://amzn.to/4ufwk48,https://clarityinsightadvisory.com/wp-content/uploads/2026/03/weleda-toothpaste.webp,9,,Essential Oxygen BR Toothpaste,$10-$20,https://amzn.to/4aU1qHa,https://clarityinsightadvisory.com/wp-content/uploads/2026/03/essential-oxygen-toothpaste.webp,9,,,,,,,,https://www.instagram.com/thewallstsurvivor/reel/DX7ugz1RmMw/
Toothpaste,Fygg,Nano-Hydroxyapatite Toothpaste Chocolate Swirl,3,"Nano-hydroxyapatite and silica with a hidden chocolate flavor, on a prebiotic base, never lab tested.",,Weleda Natural Salt Toothpaste,$9-$11,https://amzn.to/4ufwk48,https://clarityinsightadvisory.com/wp-content/uploads/2026/03/weleda-toothpaste.webp,9,,Essential Oxygen BR Toothpaste,$10-$20,https://amzn.to/4aU1qHa,https://clarityinsightadvisory.com/wp-content/uploads/2026/03/essential-oxygen-toothpaste.webp,9,,,,,,,,https://www.instagram.com/thewallstsurvivor/reel/DX7ugz1RmMw/
Toothpaste,RiseWell,Mineral Toothpaste Flavorless,4,"Three contamination-prone minerals in the base, flavorless and clean otherwise, but never lab tested for heavy metals.",,Weleda Natural Salt Toothpaste,$9-$11,https://amzn.to/4ufwk48,https://clarityinsightadvisory.com/wp-content/uploads/2026/03/weleda-toothpaste.webp,9,,Essential Oxygen BR Toothpaste,$10-$20,https://amzn.to/4aU1qHa,https://clarityinsightadvisory.com/wp-content/uploads/2026/03/essential-oxygen-toothpaste.webp,9,,,,,,,,https://www.instagram.com/thewallstsurvivor/reel/DX7ugz1RmMw/
Toothpaste,RiseWell,PRO Mineral Toothpaste,4,"Stacks regular and nano hydroxyapatite with calcium carbonate and silica, several contamination-prone minerals, never lab tested.",,Weleda Natural Salt Toothpaste,$9-$11,https://amzn.to/4ufwk48,https://clarityinsightadvisory.com/wp-content/uploads/2026/03/weleda-toothpaste.webp,9,,Essential Oxygen BR Toothpaste,$10-$20,https://amzn.to/4aU1qHa,https://clarityinsightadvisory.com/wp-content/uploads/2026/03/essential-oxygen-toothpaste.webp,9,,,,,,,,https://www.instagram.com/thewallstsurvivor/reel/DX7ugz1RmMw/
Toothpaste,RiseWell,Mineral Toothpaste,4,"Hydroxyapatite, calcium carbonate, and silica, three contamination-prone minerals in the base, with no lab test for metals.",,Weleda Natural Salt Toothpaste,$9-$11,https://amzn.to/4ufwk48,https://clarityinsightadvisory.com/wp-content/uploads/2026/03/weleda-toothpaste.webp,9,,Essential Oxygen BR Toothpaste,$10-$20,https://amzn.to/4aU1qHa,https://clarityinsightadvisory.com/wp-content/uploads/2026/03/essential-oxygen-toothpaste.webp,9,,,,,,,,https://www.instagram.com/thewallstsurvivor/reel/DX7ugz1RmMw/
Toothpaste,Desert Essence,Tea Tree Oil Whitening Plus Toothpaste - Cool Mint,2,"Calcium carbonate leads the formula with bamboo silica and sea salt adding contamination sources, never lab tested.",,Weleda Natural Salt Toothpaste,$9-$11,https://amzn.to/4ufwk48,https://clarityinsightadvisory.com/wp-content/uploads/2026/03/weleda-toothpaste.webp,9,,Essential Oxygen BR Toothpaste,$10-$20,https://amzn.to/4aU1qHa,https://clarityinsightadvisory.com/wp-content/uploads/2026/03/essential-oxygen-toothpaste.webp,9,,,,,,,,https://www.instagram.com/thewallstsurvivor/reel/DX7ugz1RmMw/
Toothpaste,Nature's Answer,activated charcoal toothpaste |Activated Charcoal Toothpaste 4oz. Nature's,2,"Calcium carbonate near the top plus activated charcoal, two contamination pathways stacked, with no lab test.",,Weleda Natural Salt Toothpaste,$9-$11,https://amzn.to/4ufwk48,https://clarityinsightadvisory.com/wp-content/uploads/2026/03/weleda-toothpaste.webp,9,,Essential Oxygen BR Toothpaste,$10-$20,https://amzn.to/4aU1qHa,https://clarityinsightadvisory.com/wp-content/uploads/2026/03/essential-oxygen-toothpaste.webp,9,,,,,,,,https://www.instagram.com/thewallstsurvivor/reel/DX7ugz1RmMw/
Toothpaste,Athena Naturals,Essential Mint Moisturizing Toothpaste,6,"No water, no high-risk mineral abrasives, and every ingredient named. As clean as a formula gets without a lab test.",,Weleda Natural Salt Toothpaste,$9-$11,https://amzn.to/4ufwk48,https://clarityinsightadvisory.com/wp-content/uploads/2026/03/weleda-toothpaste.webp,9,,Essential Oxygen BR Toothpaste,$10-$20,https://amzn.to/4aU1qHa,https://clarityinsightadvisory.com/wp-content/uploads/2026/03/essential-oxygen-toothpaste.webp,9,,,,,,,,https://www.instagram.com/thewallstsurvivor/reel/DX7ugz1RmMw/
Toothpaste,Crest,Plus Baking Soda & Peroxide Whitening,1,"A petroleum blue dye, SLS, two PEG-type ingredients, and a penetration enhancer. Standard drugstore chemistry behind a whitening claim.",,Weleda Natural Salt Toothpaste,$9-$11,https://amzn.to/4ufwk48,https://clarityinsightadvisory.com/wp-content/uploads/2026/03/weleda-toothpaste.webp,9,,Essential Oxygen BR Toothpaste,$10-$20,https://amzn.to/4aU1qHa,https://clarityinsightadvisory.com/wp-content/uploads/2026/03/essential-oxygen-toothpaste.webp,9,,,,,,,,https://www.instagram.com/thewallstsurvivor/reel/DX7ugz1RmMw/
Toothpaste,Redmond,Earthpaste with Silver,2,"Bentonite clay is the main abrasive and carries a heavy metal load, with a daily silver antimicrobial. The brand posts a Prop 65 cancer warning.",,Weleda Natural Salt Toothpaste,$9-$11,https://amzn.to/4ufwk48,https://clarityinsightadvisory.com/wp-content/uploads/2026/03/weleda-toothpaste.webp,9,,Essential Oxygen BR Toothpaste,$10-$20,https://amzn.to/4aU1qHa,https://clarityinsightadvisory.com/wp-content/uploads/2026/03/essential-oxygen-toothpaste.webp,9,,,,,,,,https://www.instagram.com/thewallstsurvivor/reel/DX7ugz1RmMw/
Toothpaste,Redmond,Earthpowder Mineral Toothpaste,2,"Bentonite clay is the first ingredient and the entire abrasive, plus sea salt, with a Prop 65 cancer warning on the label. Never lab tested.",,Weleda Natural Salt Toothpaste,$9-$11,https://amzn.to/4ufwk48,https://clarityinsightadvisory.com/wp-content/uploads/2026/03/weleda-toothpaste.webp,9,,Essential Oxygen BR Toothpaste,$10-$20,https://amzn.to/4aU1qHa,https://clarityinsightadvisory.com/wp-content/uploads/2026/03/essential-oxygen-toothpaste.webp,9,,,,,,,,https://www.instagram.com/thewallstsurvivor/reel/DX7ugz1RmMw/
Toothpaste,Primal Life Organics,Natural Toothpaste (Fruity Bubblegum etc.),2,"Three different clays plus nano-hydroxyapatite carry heavy metals, with colloidal silver leading the list as a daily antimicrobial. Never lab tested.",,Weleda Natural Salt Toothpaste,$9-$11,https://amzn.to/4ufwk48,https://clarityinsightadvisory.com/wp-content/uploads/2026/03/weleda-toothpaste.webp,9,,Essential Oxygen BR Toothpaste,$10-$20,https://amzn.to/4aU1qHa,https://clarityinsightadvisory.com/wp-content/uploads/2026/03/essential-oxygen-toothpaste.webp,9,,,,,,,,https://www.instagram.com/thewallstsurvivor/reel/DX7ugz1RmMw/
Toothpaste,Primal Life Organics,Dirty Mouth Toothpowder (Polished Peppermint etc.),2,"Bentonite, kaolin, and montmorillonite, three clays that carry heavy metals, plus nano-hydroxyapatite and charcoal in some flavors. Never lab tested.",,Weleda Natural Salt Toothpaste,$9-$11,https://amzn.to/4ufwk48,https://clarityinsightadvisory.com/wp-content/uploads/2026/03/weleda-toothpaste.webp,9,,Essential Oxygen BR Toothpaste,$10-$20,https://amzn.to/4aU1qHa,https://clarityinsightadvisory.com/wp-content/uploads/2026/03/essential-oxygen-toothpaste.webp,9,,,,,,,,https://www.instagram.com/thewallstsurvivor/reel/DX7ugz1RmMw/
Toothpaste,Give Me The Dirt,Remineralizing Tooth Powder,2,"Bentonite clay is the primary ingredient and carries a heavy metal load, with a proprietary flavor blend hiding part of the formula. Never lab tested.",,Weleda Natural Salt Toothpaste,$9-$11,https://amzn.to/4ufwk48,https://clarityinsightadvisory.com/wp-content/uploads/2026/03/weleda-toothpaste.webp,9,,Essential Oxygen BR Toothpaste,$10-$20,https://amzn.to/4aU1qHa,https://clarityinsightadvisory.com/wp-content/uploads/2026/03/essential-oxygen-toothpaste.webp,9,,,,,,,,https://www.instagram.com/thewallstsurvivor/reel/DX7ugz1RmMw/
Toothpaste,Twice,Fluoride Toothpaste Cooling Spearmint,2,"Two preservatives that can form benzene together, plus titanium dioxide, two artificial sweeteners, and a hidden flavor. Never lab tested.",,Weleda Natural Salt Toothpaste,$9-$11,https://amzn.to/4ufwk48,https://clarityinsightadvisory.com/wp-content/uploads/2026/03/weleda-toothpaste.webp,9,,Essential Oxygen BR Toothpaste,$10-$20,https://amzn.to/4aU1qHa,https://clarityinsightadvisory.com/wp-content/uploads/2026/03/essential-oxygen-toothpaste.webp,9,,,,,,,,https://www.instagram.com/thewallstsurvivor/reel/DX7ugz1RmMw/
Toothpaste,Twice,NanoHydroxyapatite FF Charcoal Icy Mint,2,"Activated charcoal concentrates heavy metals, sitting on silica and hydroxyapatite, with titanium dioxide and a hidden flavor. Never lab tested.",,Weleda Natural Salt Toothpaste,$9-$11,https://amzn.to/4ufwk48,https://clarityinsightadvisory.com/wp-content/uploads/2026/03/weleda-toothpaste.webp,9,,Essential Oxygen BR Toothpaste,$10-$20,https://amzn.to/4aU1qHa,https://clarityinsightadvisory.com/wp-content/uploads/2026/03/essential-oxygen-toothpaste.webp,9,,,,,,,,https://www.instagram.com/thewallstsurvivor/reel/DX7ugz1RmMw/
Toothpaste,Twice,Fluoride Toothpaste Wintergreen & Peppermint,2,"Two preservatives that can form benzene together, plus titanium dioxide, two artificial sweeteners, and a hidden flavor, with no lab test.",,Weleda Natural Salt Toothpaste,$9-$11,https://amzn.to/4ufwk48,https://clarityinsightadvisory.com/wp-content/uploads/2026/03/weleda-toothpaste.webp,9,,Essential Oxygen BR Toothpaste,$10-$20,https://amzn.to/4aU1qHa,https://clarityinsightadvisory.com/wp-content/uploads/2026/03/essential-oxygen-toothpaste.webp,9,,,,,,,,https://www.instagram.com/thewallstsurvivor/reel/DX7ugz1RmMw/
Toothpaste,ACT,Kids Toothpaste Bubblegum Blowout,1,"A petroleum-derived red dye and SLS in a kids paste, plus two artificial sweeteners and a hidden flavor. Kids swallow more of it.",,Weleda Natural Salt Toothpaste,$9-$11,https://amzn.to/4ufwk48,https://clarityinsightadvisory.com/wp-content/uploads/2026/03/weleda-toothpaste.webp,9,,Essential Oxygen BR Toothpaste,$10-$20,https://amzn.to/4aU1qHa,https://clarityinsightadvisory.com/wp-content/uploads/2026/03/essential-oxygen-toothpaste.webp,9,,,,,,,,https://www.instagram.com/thewallstsurvivor/reel/DX7ugz1RmMw/
Toothpaste,Jack N' Jill,Natural Toothpaste Banana 50g,5,"A genuinely minimal kids formula, certified natural by COSMOS, held back only by silica as a contamination-prone mineral and no lab test for metals.",,Weleda Natural Salt Toothpaste,$9-$11,https://amzn.to/4ufwk48,https://clarityinsightadvisory.com/wp-content/uploads/2026/03/weleda-toothpaste.webp,9,,Essential Oxygen BR Toothpaste,$10-$20,https://amzn.to/4aU1qHa,https://clarityinsightadvisory.com/wp-content/uploads/2026/03/essential-oxygen-toothpaste.webp,9,,,,,,,,https://www.instagram.com/thewallstsurvivor/reel/DX7ugz1RmMw/
Toothpaste,Aquafresh,Extreme Clean Whitening,1,"A synthetic red dye, SLS, and a PEG ingredient, plus titanium dioxide and an artificial sweetener. Standard drugstore formula behind a whitening label.",,Weleda Natural Salt Toothpaste,$9-$11,https://amzn.to/4ufwk48,https://clarityinsightadvisory.com/wp-content/uploads/2026/03/weleda-toothpaste.webp,9,,Essential Oxygen BR Toothpaste,$10-$20,https://amzn.to/4aU1qHa,https://clarityinsightadvisory.com/wp-content/uploads/2026/03/essential-oxygen-toothpaste.webp,9,,,,,,,,https://www.instagram.com/thewallstsurvivor/reel/DX7ugz1RmMw/
Toothpaste,SuperTeeth,Prebiotic Mineral Toothpaste Strawberry,4,"Hydroxyapatite and silica, two contamination-prone minerals, on an otherwise clean prebiotic formula with a named flavor. Never lab tested.",,Weleda Natural Salt Toothpaste,$9-$11,https://amzn.to/4ufwk48,https://clarityinsightadvisory.com/wp-content/uploads/2026/03/weleda-toothpaste.webp,9,,Essential Oxygen BR Toothpaste,$10-$20,https://amzn.to/4aU1qHa,https://clarityinsightadvisory.com/wp-content/uploads/2026/03/essential-oxygen-toothpaste.webp,9,,,,,,,,https://www.instagram.com/thewallstsurvivor/reel/DX7ugz1RmMw/
Toothpaste,SuperTeeth,Hydroxyapatite Prebiotic Toothpaste Mint,4,"Hydroxyapatite and silica, two contamination-prone minerals, on a clean prebiotic base with named oils. Never lab tested for metals.",,Weleda Natural Salt Toothpaste,$9-$11,https://amzn.to/4ufwk48,https://clarityinsightadvisory.com/wp-content/uploads/2026/03/weleda-toothpaste.webp,9,,Essential Oxygen BR Toothpaste,$10-$20,https://amzn.to/4aU1qHa,https://clarityinsightadvisory.com/wp-content/uploads/2026/03/essential-oxygen-toothpaste.webp,9,,,,,,,,https://www.instagram.com/thewallstsurvivor/reel/DX7ugz1RmMw/
Toothpaste,SuperTeeth,Whitening Nano-Hydroxyapatite Prebiotic Toothpaste,4,"Nano-hydroxyapatite and silica, two contamination-prone minerals, on a clean prebiotic base with named oils. Never lab tested.",,Weleda Natural Salt Toothpaste,$9-$11,https://amzn.to/4ufwk48,https://clarityinsightadvisory.com/wp-content/uploads/2026/03/weleda-toothpaste.webp,9,,Essential Oxygen BR Toothpaste,$10-$20,https://amzn.to/4aU1qHa,https://clarityinsightadvisory.com/wp-content/uploads/2026/03/essential-oxygen-toothpaste.webp,9,,,,,,,,https://www.instagram.com/thewallstsurvivor/reel/DX7ugz1RmMw/
Toothpaste,Coral,Nano Silver Toothpaste Cinnamon Tea Tree (FF),2,"Coral calcium leads the formula and carries marine contamination risk, paired with silica and a daily silver antimicrobial. Never lab tested.",,Weleda Natural Salt Toothpaste,$9-$11,https://amzn.to/4ufwk48,https://clarityinsightadvisory.com/wp-content/uploads/2026/03/weleda-toothpaste.webp,9,,Essential Oxygen BR Toothpaste,$10-$20,https://amzn.to/4aU1qHa,https://clarityinsightadvisory.com/wp-content/uploads/2026/03/essential-oxygen-toothpaste.webp,9,,,,,,,,https://www.instagram.com/thewallstsurvivor/reel/DX7ugz1RmMw/
Toothpaste,Coral,Nano Silver Kids Toothpaste Bubble Berry (FF),2,"A kids paste with coral calcium leading the formula, a daily silver antimicrobial, and a hidden berry flavor. Never lab tested, and kids swallow more.",,Weleda Natural Salt Toothpaste,$9-$11,https://amzn.to/4ufwk48,https://clarityinsightadvisory.com/wp-content/uploads/2026/03/weleda-toothpaste.webp,9,,Essential Oxygen BR Toothpaste,$10-$20,https://amzn.to/4aU1qHa,https://clarityinsightadvisory.com/wp-content/uploads/2026/03/essential-oxygen-toothpaste.webp,9,,,,,,,,https://www.instagram.com/thewallstsurvivor/reel/DX7ugz1RmMw/
Toothpaste,Better & Better,Purity Toothpaste,4,"Calcium carbonate is the main abrasive and a contamination-prone mineral, in an otherwise genuinely clean organic formula, but never lab tested for metals.",,Weleda Natural Salt Toothpaste,$9-$11,https://amzn.to/4ufwk48,https://clarityinsightadvisory.com/wp-content/uploads/2026/03/weleda-toothpaste.webp,9,,Essential Oxygen BR Toothpaste,$10-$20,https://amzn.to/4aU1qHa,https://clarityinsightadvisory.com/wp-content/uploads/2026/03/essential-oxygen-toothpaste.webp,9,,,,,,,,https://www.instagram.com/thewallstsurvivor/reel/DX7ugz1RmMw/
Shampoo,Dr. Bronner's,Pure-Castile Bar Unscented (as shampoo),10,"Cleanest way to wash hair, pair it with a vinegar rinse",,Dr. Bronner's Pure-Castile Liquid Baby Unscented,$13-$18,https://amzn.to/4aOxk6y,https://clarityinsightadvisory.com/wp-content/uploads/2026/01/Dr-Bronner-castile-liquid.webp,10,,Carina Organics Unscented Shampoo & Body Wash,$14-$30,https://amzn.to/4w9C7s6,,9,,J.R. Liggett's Original Bar Shampoo,$12-$27,https://amzn.to/4tDH5fg,https://clarityinsightadvisory.com/wp-content/uploads/2026/05/JR-Liggett.jpg,9,,
Shampoo,Dr. Bronner's,Sugar Soap Peppermint (as shampoo),10,Clean saponified hair wash from a top-certified brand,,Dr. Bronner's Pure-Castile Liquid Baby Unscented,$13-$18,https://amzn.to/4aOxk6y,https://clarityinsightadvisory.com/wp-content/uploads/2026/01/Dr-Bronner-castile-liquid.webp,10,,Carina Organics Unscented Shampoo & Body Wash,$14-$30,https://amzn.to/4w9C7s6,,9,,J.R. Liggett's Original Bar Shampoo,$12-$27,https://amzn.to/4tDH5fg,https://clarityinsightadvisory.com/wp-content/uploads/2026/05/JR-Liggett.jpg,9,,
Shampoo,A La Maison,Olive Oil Unscented Bar (as shampoo),9,Clean saponified olive oil bar that doubles as shampoo,,Dr. Bronner's Pure-Castile Liquid Baby Unscented,$13-$18,https://amzn.to/4aOxk6y,https://clarityinsightadvisory.com/wp-content/uploads/2026/01/Dr-Bronner-castile-liquid.webp,10,,Carina Organics Unscented Shampoo & Body Wash,$14-$30,https://amzn.to/4w9C7s6,,9,,J.R. Liggett's Original Bar Shampoo,$12-$27,https://amzn.to/4tDH5fg,https://clarityinsightadvisory.com/wp-content/uploads/2026/05/JR-Liggett.jpg,9,,
Shampoo,Carina Organics,Unscented Shampoo & Body Wash,9,Saponified coconut base with built-in vinegar and no synthetic preservatives or quats. A liquid soap bar in disguise.,,Dr. Bronner's Pure-Castile Liquid Baby Unscented,$13-$18,https://amzn.to/4aOxk6y,https://clarityinsightadvisory.com/wp-content/uploads/2026/01/Dr-Bronner-castile-liquid.webp,10,,Carina Organics Unscented Shampoo & Body Wash,$14-$30,https://amzn.to/4w9C7s6,,9,,J.R. Liggett's Original Bar Shampoo,$12-$27,https://amzn.to/4tDH5fg,https://clarityinsightadvisory.com/wp-content/uploads/2026/05/JR-Liggett.jpg,9,,
Shampoo,Carina Organics,Baby Shampoo & Body Wash,9,Saponified coconut base with built-in vinegar and no synthetic preservatives. Gentle enough for babies.,,Dr. Bronner's Pure-Castile Liquid Baby Unscented,$13-$18,https://amzn.to/4aOxk6y,https://clarityinsightadvisory.com/wp-content/uploads/2026/01/Dr-Bronner-castile-liquid.webp,10,,Carina Organics Unscented Shampoo & Body Wash,$14-$30,https://amzn.to/4w9C7s6,,9,,J.R. Liggett's Original Bar Shampoo,$12-$27,https://amzn.to/4tDH5fg,https://clarityinsightadvisory.com/wp-content/uploads/2026/05/JR-Liggett.jpg,9,,
Shampoo,Dr. Bronner's,Pure-Castile Liquid Tea Tree,9,"Clean castile liquid, great for scalp, skip it for young kids",,Dr. Bronner's Pure-Castile Liquid Baby Unscented,$13-$18,https://amzn.to/4aOxk6y,https://clarityinsightadvisory.com/wp-content/uploads/2026/01/Dr-Bronner-castile-liquid.webp,10,,Carina Organics Unscented Shampoo & Body Wash,$14-$30,https://amzn.to/4w9C7s6,,9,,J.R. Liggett's Original Bar Shampoo,$12-$27,https://amzn.to/4tDH5fg,https://clarityinsightadvisory.com/wp-content/uploads/2026/05/JR-Liggett.jpg,9,,
Shampoo,J.R. Liggett's,Original Bar Shampoo,9,Clean old-school bar shampoo that just works,,Dr. Bronner's Pure-Castile Liquid Baby Unscented,$13-$18,https://amzn.to/4aOxk6y,https://clarityinsightadvisory.com/wp-content/uploads/2026/01/Dr-Bronner-castile-liquid.webp,10,,Carina Organics Unscented Shampoo & Body Wash,$14-$30,https://amzn.to/4w9C7s6,,9,,J.R. Liggett's Original Bar Shampoo,$12-$27,https://amzn.to/4tDH5fg,https://clarityinsightadvisory.com/wp-content/uploads/2026/05/JR-Liggett.jpg,9,,
Shampoo,100% Pure,Glossy Locks Grow More,6,Clean plant-based base with organic botanicals and named oils. Cocamidopropyl betaine is the one ingredient holding it back.,,Dr. Bronner's Pure-Castile Liquid Baby Unscented,$13-$18,https://amzn.to/4aOxk6y,https://clarityinsightadvisory.com/wp-content/uploads/2026/01/Dr-Bronner-castile-liquid.webp,10,,Carina Organics Unscented Shampoo & Body Wash,$14-$30,https://amzn.to/4w9C7s6,,9,,J.R. Liggett's Original Bar Shampoo,$12-$27,https://amzn.to/4tDH5fg,https://clarityinsightadvisory.com/wp-content/uploads/2026/05/JR-Liggett.jpg,9,,
Shampoo,100% Pure,Burdock and Neem Healthy Scalp,6,Clean glucoside and coconut base with organic herbs and named oils. Cocamidopropyl betaine keeps it out of the top tier.,,Dr. Bronner's Pure-Castile Liquid Baby Unscented,$13-$18,https://amzn.to/4aOxk6y,https://clarityinsightadvisory.com/wp-content/uploads/2026/01/Dr-Bronner-castile-liquid.webp,10,,Carina Organics Unscented Shampoo & Body Wash,$14-$30,https://amzn.to/4w9C7s6,,9,,J.R. Liggett's Original Bar Shampoo,$12-$27,https://amzn.to/4tDH5fg,https://clarityinsightadvisory.com/wp-content/uploads/2026/05/JR-Liggett.jpg,9,,
Shampoo,100% Pure,Kelp and Mint Volumizing,6,Mild plant-based base with organic extracts and disclosed allergens. Cocamidopropyl betaine is the ceiling here.,,Dr. Bronner's Pure-Castile Liquid Baby Unscented,$13-$18,https://amzn.to/4aOxk6y,https://clarityinsightadvisory.com/wp-content/uploads/2026/01/Dr-Bronner-castile-liquid.webp,10,,Carina Organics Unscented Shampoo & Body Wash,$14-$30,https://amzn.to/4w9C7s6,,9,,J.R. Liggett's Original Bar Shampoo,$12-$27,https://amzn.to/4tDH5fg,https://clarityinsightadvisory.com/wp-content/uploads/2026/05/JR-Liggett.jpg,9,,
Shampoo,Big Crazy,Buffalo Mountain Rain Bison Tallow,7,"Clean saponified tallow bar, just needs a real label",,Dr. Bronner's Pure-Castile Liquid Baby Unscented,$13-$18,https://amzn.to/4aOxk6y,https://clarityinsightadvisory.com/wp-content/uploads/2026/01/Dr-Bronner-castile-liquid.webp,10,,Carina Organics Unscented Shampoo & Body Wash,$14-$30,https://amzn.to/4w9C7s6,,9,,J.R. Liggett's Original Bar Shampoo,$12-$27,https://amzn.to/4tDH5fg,https://clarityinsightadvisory.com/wp-content/uploads/2026/05/JR-Liggett.jpg,9,,
Shampoo,California Naturals,Sensitive Scalp Shampoo,7,"Mild base, real botanicals, scented only by disclosed extracts",,Dr. Bronner's Pure-Castile Liquid Baby Unscented,$13-$18,https://amzn.to/4aOxk6y,https://clarityinsightadvisory.com/wp-content/uploads/2026/01/Dr-Bronner-castile-liquid.webp,10,,Carina Organics Unscented Shampoo & Body Wash,$14-$30,https://amzn.to/4w9C7s6,,9,,J.R. Liggett's Original Bar Shampoo,$12-$27,https://amzn.to/4tDH5fg,https://clarityinsightadvisory.com/wp-content/uploads/2026/05/JR-Liggett.jpg,9,,
Shampoo,California Naturals,Re:GRO Anti-Thinning,7,"Mild base with targeted hair-growth actives, no fragrance loophole",,Dr. Bronner's Pure-Castile Liquid Baby Unscented,$13-$18,https://amzn.to/4aOxk6y,https://clarityinsightadvisory.com/wp-content/uploads/2026/01/Dr-Bronner-castile-liquid.webp,10,,Carina Organics Unscented Shampoo & Body Wash,$14-$30,https://amzn.to/4w9C7s6,,9,,J.R. Liggett's Original Bar Shampoo,$12-$27,https://amzn.to/4tDH5fg,https://clarityinsightadvisory.com/wp-content/uploads/2026/05/JR-Liggett.jpg,9,,
Shampoo,John Masters Organics,Shampoo,7,"Glucoside and amino-acid base, plant-derived preservation, and named oils. One synthetic quat is the only knock.",,Dr. Bronner's Pure-Castile Liquid Baby Unscented,$13-$18,https://amzn.to/4aOxk6y,https://clarityinsightadvisory.com/wp-content/uploads/2026/01/Dr-Bronner-castile-liquid.webp,10,,Carina Organics Unscented Shampoo & Body Wash,$14-$30,https://amzn.to/4w9C7s6,,9,,J.R. Liggett's Original Bar Shampoo,$12-$27,https://amzn.to/4tDH5fg,https://clarityinsightadvisory.com/wp-content/uploads/2026/05/JR-Liggett.jpg,9,,
Shampoo,100% Pure,Honey and Virgin Coconut Restorative,6,"Clean plant-based base with organic botanicals, but Natural Coconut Flavor is a fragrance loophole.",,Dr. Bronner's Pure-Castile Liquid Baby Unscented,$13-$18,https://amzn.to/4aOxk6y,https://clarityinsightadvisory.com/wp-content/uploads/2026/01/Dr-Bronner-castile-liquid.webp,10,,Carina Organics Unscented Shampoo & Body Wash,$14-$30,https://amzn.to/4w9C7s6,,9,,J.R. Liggett's Original Bar Shampoo,$12-$27,https://amzn.to/4tDH5fg,https://clarityinsightadvisory.com/wp-content/uploads/2026/05/JR-Liggett.jpg,9,,
Shampoo,Acure,Ultra Hydrating Shampoo,6,"Cocamidopropyl betaine sets the ceiling for this liquid, but the rest of the formula is clean and disclosed.",,Dr. Bronner's Pure-Castile Liquid Baby Unscented,$13-$18,https://amzn.to/4aOxk6y,https://clarityinsightadvisory.com/wp-content/uploads/2026/01/Dr-Bronner-castile-liquid.webp,10,,Carina Organics Unscented Shampoo & Body Wash,$14-$30,https://amzn.to/4w9C7s6,,9,,J.R. Liggett's Original Bar Shampoo,$12-$27,https://amzn.to/4tDH5fg,https://clarityinsightadvisory.com/wp-content/uploads/2026/05/JR-Liggett.jpg,9,,
Shampoo,Acure,Daily Workout Shampoo,6,"A clean liquid formula held to mid-tier by cocamidopropyl betaine, the common ceiling for the bottled format.",,Dr. Bronner's Pure-Castile Liquid Baby Unscented,$13-$18,https://amzn.to/4aOxk6y,https://clarityinsightadvisory.com/wp-content/uploads/2026/01/Dr-Bronner-castile-liquid.webp,10,,Carina Organics Unscented Shampoo & Body Wash,$14-$30,https://amzn.to/4w9C7s6,,9,,J.R. Liggett's Original Bar Shampoo,$12-$27,https://amzn.to/4tDH5fg,https://clarityinsightadvisory.com/wp-content/uploads/2026/05/JR-Liggett.jpg,9,,
Shampoo,Acure,Vivacious Volume Shampoo,6,"Clean within the limits of a liquid shampoo, with cocamidopropyl betaine as the main ceiling.",,Dr. Bronner's Pure-Castile Liquid Baby Unscented,$13-$18,https://amzn.to/4aOxk6y,https://clarityinsightadvisory.com/wp-content/uploads/2026/01/Dr-Bronner-castile-liquid.webp,10,,Carina Organics Unscented Shampoo & Body Wash,$14-$30,https://amzn.to/4w9C7s6,,9,,J.R. Liggett's Original Bar Shampoo,$12-$27,https://amzn.to/4tDH5fg,https://clarityinsightadvisory.com/wp-content/uploads/2026/05/JR-Liggett.jpg,9,,
